{
  "$schema": "https://json-schema.org/draft/2020-12/schema",
  "$id": "https://bugsweep.dev/bench/corpus/schema.json",
  "title": "Bugsweep bench detection case",
  "description": "A single ground-truthed detection case: a known vulnerability in an open-source repo at a pinned pre-fix commit, with the fix commit and the exact ground-truth hunks the harness scores detections against.",
  "type": "object",
  "additionalProperties": false,
  "required": [
    "id",
    "language",
    "category",
    "source",
    "ground_truth",
    "size_ceiling",
    "cross_file"
  ],
  "properties": {
    "id": {
      "type": "string",
      "description": "Stable, unique case identifier (kebab/dotted, no spaces).",
      "minLength": 1,
      "pattern": "^[A-Za-z0-9._-]+$"
    },
    "language": {
      "type": "string",
      "description": "Primary language of the vulnerable code (e.g. python, javascript, go).",
      "minLength": 1
    },
    "category": {
      "type": "string",
      "description": "Bug category / lens (e.g. sql-injection, path-traversal, race-condition).",
      "minLength": 1
    },
    "cwe": {
      "type": "string",
      "description": "Optional CWE identifier for the vulnerability class (e.g. CWE-89).",
      "minLength": 1
    },
    "source": {
      "type": "object",
      "description": "Provenance: where the case comes from and the commits that bracket the fix.",
      "additionalProperties": false,
      "required": [
        "repo",
        "pre_fix_commit",
        "fix_commit",
        "advisory_url",
        "disclosure_date"
      ],
      "properties": {
        "repo": {
          "type": "string",
          "description": "Clonable URL of the source repository.",
          "minLength": 1
        },
        "pre_fix_commit": {
          "type": "string",
          "description": "Full 40-char git SHA of the commit that still contains the bug (the SHA the harness clones and analyzes).",
          "pattern": "^[0-9a-fA-F]{40}$"
        },
        "fix_commit": {
          "type": "string",
          "description": "Full 40-char git SHA of the commit that fixed the bug.",
          "pattern": "^[0-9a-fA-F]{40}$"
        },
        "advisory_url": {
          "type": "string",
          "description": "URL of the advisory / disclosure that documents the vulnerability.",
          "minLength": 1
        },
        "disclosure_date": {
          "type": "string",
          "description": "ISO 8601 date (YYYY-MM-DD) the vulnerability was disclosed; used to enforce the post-cutoff floor.",
          "pattern": "^[0-9]{4}-[0-9]{2}-[0-9]{2}$"
        }
      }
    },
    "ground_truth": {
      "type": "object",
      "description": "The scorable truth: which file regions constitute the bug, plus human-readable context.",
      "additionalProperties": false,
      "required": ["hunks", "files", "description", "fix_summary"],
      "properties": {
        "hunks": {
          "type": "array",
          "description": "Line ranges that contain the vulnerability; a detection is credited when it overlaps one of these.",
          "minItems": 1,
          "items": {
            "type": "object",
            "additionalProperties": false,
            "required": ["file", "start", "end"],
            "properties": {
              "file": {
                "type": "string",
                "description": "Repo-relative path to the file containing the hunk.",
                "minLength": 1
              },
              "start": {
                "type": "integer",
                "description": "First line of the hunk (1-based, inclusive).",
                "minimum": 1
              },
              "end": {
                "type": "integer",
                "description": "Last line of the hunk (1-based, inclusive).",
                "minimum": 1
              }
            }
          }
        },
        "files": {
          "type": "array",
          "description": "All repo-relative files involved in the bug.",
          "minItems": 1,
          "items": {
            "type": "string",
            "minLength": 1
          }
        },
        "description": {
          "type": "string",
          "description": "Human-readable description of the vulnerability.",
          "minLength": 1
        },
        "fix_summary": {
          "type": "string",
          "description": "Human-readable summary of how the fix commit addressed the bug.",
          "minLength": 1
        }
      }
    },
    "size_ceiling": {
      "type": "object",
      "description": "Per-case size bounds; the runner SKIPs a clone that exceeds either ceiling to bound context-build cost.",
      "additionalProperties": false,
      "required": ["max_files", "max_loc"],
      "properties": {
        "max_files": {
          "type": "integer",
          "description": "Maximum number of files the clone may contain before the runner SKIPs the case.",
          "minimum": 1
        },
        "max_loc": {
          "type": "integer",
          "description": "Maximum total lines of code the clone may contain before the runner SKIPs the case.",
          "minimum": 1
        }
      }
    },
    "cross_file": {
      "type": "boolean",
      "description": "True if the bug spans more than one file (used to enforce the cross-file floor in the corpus)."
    }
  }
}
