{
  "id": "py-sec-flask-security-46715",
  "language": "python",
  "category": "security",
  "cwe": "CWE-287",
  "source": {
    "repo": "https://github.com/pallets-eco/flask-security.git",
    "pre_fix_commit": "18808e1e642c4466f8daa46a68d4e1f77a6d1713",
    "fix_commit": "8e69f3a94a463c0e8ddc46e31743717559fd8d48",
    "advisory_url": "https://github.com/pallets-eco/flask-security/security/advisories/GHSA-97r5-pg8x-p63p",
    "disclosure_date": "2026-05-22"
  },
  "ground_truth": {
    "hunks": [
      { "file": "flask_security/oauth_glue.py", "start": 105, "end": 118 },
      { "file": "flask_security/oauth_glue.py", "start": 208, "end": 214 }
    ],
    "files": ["flask_security/oauth_glue.py"],
    "description": "The OAuth account-verification flow in oauth_glue.py trusts the identity attribute returned by the OAuth provider without confirming it belongs to the currently logged-in user. oauth_verify_response() set the freshness/verification timestamp for any user resolved from the OAuth response, so an attacker who can complete an OAuth flow with a different provider account could 'verify' the victim's session. The identity field was also not constrained to configured IDENTITY_ATTRIBUTES nor passed through the attribute mapper.",
    "fix_summary": "The fix gates the verification branch on `user and user.email == current_user.email` so the OAuth identity must match the logged-in user, and validates the returned field against get_identity_attribute() (raising OAuthError for unknown attributes) before running it through the attribute mapper. Test file tests/test_oauthglue.py and CHANGES.rst were also updated by the fix commit."
  },
  "size_ceiling": { "max_files": 200000, "max_loc": 20000000 },
  "cross_file": false
}
