{
  "id": "py-logic-wger-language",
  "language": "python",
  "category": "logic",
  "source": {
    "repo": "https://github.com/wger-project/wger.git",
    "pre_fix_commit": "a6cddb94d494405fbfc4da158b6ae710cd83e207",
    "fix_commit": "d15a5a646cb8678a5ba26a2337907a1cdfa3c351",
    "advisory_url": "https://github.com/wger-project/wger/pull/2356",
    "disclosure_date": "2026-05-25"
  },
  "ground_truth": {
    "hunks": [
      { "file": "wger/nutrition/api/filtersets.py", "start": 23, "end": 29 },
      { "file": "wger/nutrition/api/filtersets.py", "start": 99, "end": 110 }
    ],
    "files": ["wger/nutrition/api/filtersets.py"],
    "description": "search_languagecode() in filtersets.py maps each comma-separated language code through load_language(). load_language() defaults unknown codes to English, so an unrecognized language code silently resolves to English rather than being ignored as the docstring promises ('Unknown codes are ignored'). The filter then matches English ingredients for a bogus code instead of returning no language constraint.",
    "fix_summary": "The fix calls load_language(code, default_to_english=False) inside a try/except that swallows Language.DoesNotExist, so unknown codes are dropped instead of defaulting to English; only resolvable languages are appended to the filter list. It adds the `from wger.core.models import Language` import needed for the exception. Test file wger/nutrition/tests/test_search_api.py was updated by the fix commit (PR #2356)."
  },
  "size_ceiling": { "max_files": 200000, "max_loc": 20000000 },
  "cross_file": false
}
